{"artifact":{"immutable_revision":"version-id:fixture-v1","media_type":"application/mcap","sha256":"b55b1327d97412b150ada1a77be869545eb65bb65db52d0d69e6e6a5fb5138de","size_bytes":30,"uri":"s3://robotics-fixture/run-10000000-0000-4000-8000-000000000001/output.mcap?versionId=fixture-v1"},"created_at":"2026-07-11T12:01:00Z","producer":{"identity":"https://github.com/example/evidence/.github/workflows/retain.yml","implementation":"aws-cli"},"receipt_id":"retained-evidence-receipt","run_id":"run-10000000-0000-4000-8000-000000000001","schema_version":"artifact-receipt.v1","statement_sha256":"8dfb0d8aef4d907cfc6e50ffda7a334b7ea008b2d36665cfb1f0f10334ba7b88","verification_sha256":"507711a5115e079975b9a9b415ea73fcae6bf0bc2cda0f9f03cf3015a16ab2bc"}
