{"artifact":{"immutable_revision":"sha256:a9f3c61cefdc82ae15ea38847921437b5bf521d6d5a05171226284fe597e7210","media_type":"application/vnd.python.wheel","sha256":"a9f3c61cefdc82ae15ea38847921437b5bf521d6d5a05171226284fe597e7210","size_bytes":24,"uri":"file:///packages/evaluator-a9f3c61cefdc82ae15ea38847921437b5bf521d6d5a05171226284fe597e7210.whl"},"created_at":"2026-07-11T12:00:00Z","producer":{"identity":"https://github.com/example/evaluator/.github/workflows/release.yml","implementation":"pypa-build"},"receipt_id":"evaluator-wheel-receipt","schema_version":"artifact-receipt.v1","statement_sha256":"3c2a456f4a404c944235b41f3e7a2add3d8dca175ddccf84ffeaf8e0c78d5504","verification_sha256":"6d52ab24561ae9614123c9c906788ef6dbe607bc3326ec7c257e884a09c09f7c"}
